{
  "innate": {
    "id": "marci_special_delivery",
    "Name": "Special Delivery",
    "behavior": [
      "no-target"
    ],
    "type": "self-target",
    "tags": [
      "courier_utility"
    ]
  },
  "skills": [
    {
      "id": "marci_grapple",
      "Name": "Dispose",
      "behavior": [
        "unit-target"
      ],
      "affects": [
        "units"
      ],
      "dispellable": "yes",
      "dispelType": "basic",
      "piercesDebuffImmunity": "no",
      "damageType": "magical",
      "order": 0,
      "type": "target",
      "target": [
        "self",
        "ally_hero",
        "enemy_hero",
        "ally_creep",
        "enemy_creep",
        "neutral_creep"
      ],
      "manaCost": 80,
      "cooldown": [
        16,
        14,
        12,
        10
      ],
      "tags": [
        "ally_reposition",
        "enemy_displacement",
        "escape",
        "mobility",
        "slow"
      ]
    },
    {
      "id": "marci_companion_run",
      "Name": "Rebound",
      "behavior": [
        "point-vector-target",
        "unit-target"
      ],
      "affects": [
        "allied-units"
      ],
      "dispellable": "strong-only",
      "dispelType": "strong",
      "piercesDebuffImmunity": "no",
      "damageType": "magical",
      "order": 1,
      "type": "vector",
      "target": [
        "self",
        "ally_hero"
      ],
      "manaCost": [
        70,
        80,
        90,
        100
      ],
      "tags": [
        "ally_movement_speed",
        "buff",
        "disable",
        "escape",
        "mobility",
        "stun"
      ]
    },
    {
      "id": "marci_bodyguard",
      "Name": "Bodyguard",
      "behavior": [
        "unit-target"
      ],
      "affects": [
        "allied-heroes"
      ],
      "dispellable": "yes",
      "dispelType": "basic",
      "piercesDebuffImmunity": "allies-only",
      "damageType": "physical",
      "order": 2,
      "type": "target",
      "target": [
        "self",
        "ally_hero"
      ],
      "manaCost": 60,
      "cooldown": 20,
      "tags": [
        "barrier",
        "buff",
        "damage_sharing",
        "lifesteal",
        "self_attack_damage",
        "self_lifesteal"
      ]
    },
    {
      "id": "generic_hidden",
      "order": 4,
      "type": "unknown",
      "tags": []
    },
    {
      "id": "marci_unleash",
      "Name": "Unleash",
      "behavior": [
        "no-target"
      ],
      "dispellable": "no",
      "damageType": "magical",
      "order": 5,
      "type": "self-target",
      "tags": [
        "buff",
        "damage_over_time",
        "dispel",
        "enemy_attack_speed_reduction",
        "self_attack_speed",
        "self_movement_speed",
        "slow"
      ]
    },
    {
      "id": "marci_guardian",
      "behavior": [
        "unit-target"
      ],
      "affects": [
        "allied-heroes"
      ],
      "dispellable": "no",
      "piercesDebuffImmunity": "allies-only",
      "damageType": "physical",
      "order": 15,
      "type": "target",
      "target": [
        "self",
        "ally_hero"
      ],
      "manaCost": [
        45,
        40,
        35,
        30
      ],
      "cooldown": 20,
      "tags": [
        "ally_attack_damage",
        "buff",
        "lifesteal",
        "self_attack_damage",
        "self_lifesteal"
      ]
    }
  ],
  "talents": [
    {
      "id": "special_bonus_unique_marci_dispose_slow",
      "behavior": [
        "passive"
      ],
      "tags": []
    },
    {
      "id": "special_bonus_unique_marci_rebound_radius",
      "behavior": [
        "passive"
      ],
      "tags": []
    },
    {
      "id": "special_bonus_unique_marci_grapple_damage",
      "behavior": [
        "passive"
      ],
      "tags": [
        "ability_damage_bonus",
        "buff"
      ]
    },
    {
      "id": "special_bonus_unique_marci_guardian_damage",
      "behavior": [
        "passive"
      ],
      "tags": [
        "ally_attack_damage",
        "buff",
        "self_attack_damage"
      ]
    },
    {
      "id": "special_bonus_unique_marci_grapple_stun_duration",
      "behavior": [
        "passive"
      ],
      "tags": []
    },
    {
      "id": "special_bonus_unique_marci_unleash_speed",
      "behavior": [
        "passive"
      ],
      "tags": []
    },
    {
      "id": "special_bonus_unique_marci_unleash_extend_duration",
      "behavior": [
        "passive"
      ],
      "tags": []
    },
    {
      "id": "special_bonus_unique_marci_guardian_strong_dispel",
      "Name": "Bodyguard Strong Dispels",
      "tags": []
    },
    {
      "id": "special_bonus_unique_marci_guardian_lifesteal",
      "behavior": [
        "passive"
      ],
      "tags": []
    },
    {
      "id": "special_bonus_unique_marci_lunge_range",
      "behavior": [
        "passive"
      ],
      "tags": [
        "buff",
        "cast_range"
      ]
    },
    {
      "id": "special_bonus_unique_marci_lunge_movespeed",
      "behavior": [
        "passive"
      ],
      "tags": []
    }
  ],
  "bonus_attributes": {
    "id": "special_bonus_attributes",
    "behavior": [
      "passive"
    ],
    "tags": []
  }
}
