{
  "innate": [
    {
      "id": "shadow_demon_menace",
      "Name": "Menace",
      "behavior": [
        "passive"
      ],
      "dispellable": "no",
      "breakable": true,
      "tags": [
        "incoming_damage_amplification"
      ]
    },
    {
      "id": "shadow_demon_shadow_servant",
      "Name": "Soul Catcher",
      "behavior": [
        "passive"
      ],
      "tags": [
        "illusions"
      ]
    }
  ],
  "skills": [
    {
      "id": "shadow_demon_disruption",
      "Name": "Disruption",
      "behavior": [
        "unit-target"
      ],
      "affects": [
        "allied-heroes",
        "enemy-heroes"
      ],
      "dispellable": "no",
      "piercesDebuffImmunity": "no",
      "order": 0,
      "type": "target",
      "target": [
        "self",
        "ally_hero",
        "enemy_hero"
      ],
      "manaCost": 120,
      "tags": [
        "illusions"
      ]
    },
    {
      "id": "shadow_demon_disseminate",
      "Name": "Disseminate",
      "behavior": [
        "unit-target"
      ],
      "affects": [
        "units"
      ],
      "piercesDebuffImmunity": "no",
      "order": 1,
      "type": "target",
      "target": [
        "self",
        "ally_hero",
        "enemy_hero",
        "ally_creep",
        "enemy_creep",
        "neutral_creep"
      ],
      "manaCost": 100,
      "cooldown": [
        26,
        22,
        18,
        14
      ],
      "tags": [
        "aoe",
        "buff",
        "cast_range"
      ]
    },
    {
      "id": "shadow_demon_shadow_poison",
      "Name": "Shadow Poison",
      "behavior": [
        "point-target"
      ],
      "dispellable": "no",
      "piercesDebuffImmunity": "no",
      "damageType": "magical",
      "order": 2,
      "type": "point",
      "manaCost": 40,
      "tags": [
        "aoe"
      ]
    },
    {
      "id": "shadow_demon_shadow_poison_release",
      "Name": "Shadow Poison Release",
      "behavior": [
        "no-target"
      ],
      "order": 3,
      "type": "self-target",
      "cooldown": 1,
      "tags": []
    },
    {
      "id": "shadow_demon_demonic_cleanse",
      "Name": "Demonic Cleanse",
      "behavior": [
        "unit-target"
      ],
      "affects": [
        "allied-units"
      ],
      "dispellable": "no",
      "piercesDebuffImmunity": "yes",
      "order": 4,
      "type": "target",
      "target": [
        "self",
        "ally_hero",
        "ally_creep"
      ],
      "manaCost": 150,
      "cooldown": 60,
      "tags": [
        "ally_dispel",
        "dispel"
      ]
    },
    {
      "id": "shadow_demon_demonic_purge",
      "Name": "Demonic Purge",
      "behavior": [
        "unit-target"
      ],
      "affects": [
        "enemy-units"
      ],
      "dispellable": "no",
      "piercesDebuffImmunity": "yes",
      "damageType": "magical",
      "order": 5,
      "type": "target",
      "target": [
        "enemy_hero",
        "enemy_creep",
        "neutral_creep"
      ],
      "manaCost": [
        150,
        175,
        200
      ],
      "tags": [
        "bkb_pierce",
        "break",
        "dispel",
        "slow"
      ]
    },
    {
      "id": "shadow_demon_soul_catcher",
      "behavior": [
        "point-target"
      ],
      "dispellable": "yes",
      "dispelType": "basic",
      "piercesDebuffImmunity": "no",
      "damageType": "pure",
      "order": 16,
      "type": "point",
      "manaCost": [
        80,
        100,
        120,
        140
      ],
      "cooldown": [
        26,
        24,
        22,
        20
      ],
      "tags": [
        "aoe"
      ]
    }
  ],
  "talents": [
    {
      "id": "special_bonus_unique_shadow_demon_4",
      "tags": []
    },
    {
      "id": "special_bonus_strength_8",
      "Name": "+8 Strength",
      "behavior": [
        "passive"
      ],
      "tags": [
        "attribute_bonus",
        "buff"
      ]
    },
    {
      "id": "special_bonus_movement_speed_20",
      "Name": "+20 Movement Speed",
      "behavior": [
        "passive"
      ],
      "tags": [
        "buff",
        "self_movement_speed"
      ]
    },
    {
      "id": "special_bonus_unique_shadow_demon_3",
      "tags": [
        "buff",
        "cooldown_reduction"
      ]
    },
    {
      "id": "special_bonus_unique_shadow_demon_disseminate_damage",
      "tags": []
    },
    {
      "id": "special_bonus_unique_shadow_demon_9",
      "tags": [
        "buff",
        "cooldown_reduction"
      ]
    },
    {
      "id": "special_bonus_unique_shadow_demon_purge_poison",
      "Name": "Demonic Purge Applies Shadow Poison",
      "tags": []
    },
    {
      "id": "special_bonus_unique_shadow_demon_7",
      "tags": [
        "buff",
        "cooldown_reduction"
      ]
    }
  ],
  "bonus_attributes": {
    "id": "special_bonus_attributes",
    "behavior": [
      "passive"
    ],
    "tags": []
  }
}
