{
  "innate": [
    {
      "id": "enigma_event_horizon",
      "Name": "Event Horizon",
      "behavior": [
        "passive"
      ],
      "dispellable": "no",
      "breakable": true,
      "tags": [
        "slow"
      ]
    },
    {
      "id": "enigma_gravity_well",
      "Name": "Gravity Well",
      "behavior": [
        "passive"
      ],
      "breakable": true,
      "tags": [
        "buff",
        "damage_reduction"
      ]
    }
  ],
  "skills": [
    {
      "id": "enigma_malefice",
      "Name": "Malefice",
      "behavior": [
        "unit-target"
      ],
      "affects": [
        "enemy-units"
      ],
      "dispellable": "yes",
      "dispelType": "basic",
      "piercesDebuffImmunity": "no",
      "damageType": "magical",
      "order": 0,
      "type": "target",
      "target": [
        "enemy_hero",
        "enemy_creep",
        "neutral_creep"
      ],
      "manaCost": [
        100,
        110,
        120,
        130
      ],
      "cooldown": [
        20,
        18,
        16,
        14
      ],
      "tags": [
        "damage_over_time",
        "disable",
        "stun"
      ]
    },
    {
      "id": "enigma_demonic_conversion",
      "Name": "Demonic Summoning",
      "behavior": [
        "point-target"
      ],
      "damageType": "physical",
      "order": 1,
      "type": "point",
      "manaCost": [
        70,
        80,
        90,
        100
      ],
      "cooldown": [
        45,
        40,
        35,
        30
      ],
      "tags": [
        "summons"
      ]
    },
    {
      "id": "enigma_midnight_pulse",
      "Name": "Midnight Pulse",
      "behavior": [
        "point-target"
      ],
      "piercesDebuffImmunity": "yes",
      "damageType": "magical",
      "order": 2,
      "type": "point",
      "manaCost": [
        65,
        90,
        115,
        140
      ],
      "cooldown": [
        40,
        35,
        30,
        25
      ],
      "tags": [
        "aoe",
        "bkb_pierce",
        "damage_over_time"
      ]
    },
    {
      "id": "generic_hidden",
      "order": 4,
      "type": "unknown",
      "tags": []
    },
    {
      "id": "enigma_black_hole",
      "Name": "Black Hole",
      "behavior": [
        "channeled",
        "point-target"
      ],
      "piercesDebuffImmunity": "yes",
      "damageType": "pure",
      "order": 5,
      "type": "point",
      "manaCost": [
        300,
        400,
        500
      ],
      "cooldown": [
        180,
        170,
        160
      ],
      "tags": [
        "aoe",
        "bkb_pierce",
        "channeled",
        "enemy_displacement"
      ]
    },
    {
      "id": "enigma_splitting_image",
      "Name": "Splitting Image",
      "behavior": [
        "passive"
      ],
      "dispellable": "no",
      "breakable": true,
      "order": 16,
      "type": "passive",
      "tags": [
        "summons"
      ]
    }
  ],
  "talents": [
    {
      "id": "special_bonus_unique_enigma_4",
      "behavior": [
        "passive"
      ],
      "tags": []
    },
    {
      "id": "special_bonus_unique_enigma_6",
      "behavior": [
        "passive"
      ],
      "tags": [
        "ability_damage_bonus",
        "buff"
      ]
    },
    {
      "id": "special_bonus_hp_250",
      "Name": "+250 Health",
      "behavior": [
        "passive"
      ],
      "tags": [
        "buff",
        "self_max_health"
      ]
    },
    {
      "id": "special_bonus_unique_enigma_5",
      "behavior": [
        "passive"
      ],
      "tags": []
    },
    {
      "id": "special_bonus_unique_enigma_9",
      "behavior": [
        "passive"
      ],
      "tags": [
        "area_increase",
        "buff"
      ]
    },
    {
      "id": "special_bonus_unique_enigma_3",
      "behavior": [
        "passive"
      ],
      "tags": []
    },
    {
      "id": "special_bonus_unique_enigma_2",
      "behavior": [
        "passive"
      ],
      "tags": []
    },
    {
      "id": "special_bonus_unique_enigma",
      "behavior": [
        "passive"
      ],
      "tags": []
    }
  ],
  "bonus_attributes": {
    "id": "special_bonus_attributes",
    "behavior": [
      "passive"
    ],
    "tags": []
  }
}
