{
  "innate": [
    {
      "id": "sven_wrath_of_god",
      "Name": "Wrath of God",
      "behavior": [
        "passive"
      ],
      "breakable": true,
      "tags": [
        "attribute_bonus",
        "buff",
        "self_attack_damage"
      ]
    },
    {
      "id": "sven_vanquisher",
      "Name": "Vanquisher",
      "behavior": [
        "passive"
      ],
      "breakable": true,
      "tags": [
        "buff",
        "self_attack_damage"
      ]
    }
  ],
  "skills": [
    {
      "id": "sven_storm_bolt",
      "Name": "Storm Hammer",
      "behavior": [
        "unit-target"
      ],
      "affects": [
        "enemy-units"
      ],
      "dispellable": "strong-only",
      "dispelType": "strong",
      "piercesDebuffImmunity": "no",
      "damageType": "magical",
      "order": 0,
      "type": "target",
      "target": [
        "enemy_hero",
        "enemy_creep",
        "neutral_creep"
      ],
      "tags": [
        "aoe",
        "disable",
        "dispel",
        "escape",
        "mobility",
        "self_reposition",
        "stun"
      ]
    },
    {
      "id": "sven_great_cleave",
      "Name": "Great Cleave",
      "behavior": [
        "passive"
      ],
      "piercesDebuffImmunity": "yes",
      "breakable": true,
      "order": 1,
      "type": "passive",
      "tags": [
        "attack_damage_scaling",
        "bkb_pierce",
        "cleave"
      ]
    },
    {
      "id": "sven_warcry",
      "Name": "Warcry",
      "behavior": [
        "no-target"
      ],
      "dispellable": "yes",
      "dispelType": "basic",
      "piercesDebuffImmunity": "allies-only",
      "breakable": true,
      "order": 2,
      "type": "self-target",
      "manaCost": [
        30,
        35,
        40,
        45
      ],
      "cooldown": [
        36,
        32,
        28,
        24
      ],
      "tags": [
        "ally_armor",
        "ally_movement_speed",
        "buff",
        "self_movement_speed"
      ]
    },
    {
      "id": "generic_hidden",
      "order": 3,
      "type": "unknown",
      "tags": []
    },
    {
      "id": "sven_gods_strength",
      "Name": "God's Strength",
      "behavior": [
        "no-target"
      ],
      "dispellable": "no",
      "order": 4,
      "type": "self-target",
      "manaCost": [
        100,
        125,
        150
      ],
      "tags": [
        "attack_damage_scaling",
        "buff",
        "slow_resistance"
      ]
    }
  ],
  "talents": [
    {
      "id": "special_bonus_unique_sven_5",
      "tags": [
        "duration_extension"
      ]
    },
    {
      "id": "special_bonus_unique_sven_gods_strength_slow_resist",
      "tags": []
    },
    {
      "id": "special_bonus_unique_sven_3",
      "tags": [
        "buff",
        "cooldown_reduction"
      ]
    },
    {
      "id": "special_bonus_unique_sven_8",
      "tags": []
    },
    {
      "id": "special_bonus_unique_sven_stormhammer_cooldown",
      "tags": [
        "buff",
        "cooldown_reduction",
        "mana_cost_reduction"
      ]
    },
    {
      "id": "special_bonus_unique_sven_7",
      "tags": [
        "ally_armor",
        "buff"
      ]
    },
    {
      "id": "special_bonus_unique_sven_2",
      "tags": []
    },
    {
      "id": "special_bonus_unique_sven_4",
      "tags": [
        "duration_extension",
        "stun"
      ]
    }
  ],
  "bonus_attributes": {
    "id": "special_bonus_attributes",
    "behavior": [
      "passive"
    ],
    "tags": []
  }
}
