{
  "innate": {
    "id": "juggernaut_bladeform",
    "Name": "Bladeform",
    "behavior": [
      "passive"
    ],
    "breakable": true,
    "tags": [
      "attribute_bonus",
      "buff",
      "self_movement_speed"
    ]
  },
  "skills": [
    {
      "id": "juggernaut_blade_fury",
      "Name": "Blade Fury",
      "behavior": [
        "no-target"
      ],
      "dispellable": "no",
      "piercesDebuffImmunity": "no",
      "damageType": "magical",
      "order": 0,
      "type": "self-target",
      "manaCost": 110,
      "tags": [
        "damage_over_time",
        "dispel"
      ]
    },
    {
      "id": "juggernaut_healing_ward",
      "Name": "Healing Ward",
      "behavior": [
        "point-target"
      ],
      "piercesDebuffImmunity": "allies-only",
      "order": 1,
      "type": "point",
      "manaCost": 120,
      "tags": [
        "ally_heal",
        "aoe",
        "self_heal"
      ]
    },
    {
      "id": "juggernaut_blade_dance",
      "Name": "Blade Dance",
      "behavior": [
        "passive"
      ],
      "breakable": true,
      "order": 2,
      "type": "passive",
      "tags": [
        "attack_damage_scaling",
        "buff",
        "self_attack_damage"
      ]
    },
    {
      "id": "juggernaut_swift_slash",
      "Name": "Swiftslash",
      "behavior": [
        "unit-target"
      ],
      "affects": [
        "enemy-units"
      ],
      "dispellable": "no",
      "piercesDebuffImmunity": "yes",
      "damageType": "physical",
      "order": 3,
      "type": "target",
      "target": [
        "enemy_hero",
        "enemy_creep",
        "neutral_creep"
      ],
      "manaCost": 150,
      "cooldown": 25,
      "tags": []
    },
    {
      "id": "juggernaut_omni_slash",
      "Name": "Omnislash",
      "behavior": [
        "unit-target"
      ],
      "affects": [
        "enemy-units"
      ],
      "dispellable": "no",
      "piercesDebuffImmunity": "yes",
      "damageType": "physical",
      "order": 5,
      "type": "target",
      "target": [
        "enemy_hero",
        "enemy_creep",
        "neutral_creep"
      ],
      "manaCost": [
        200,
        275,
        350
      ],
      "tags": [
        "bkb_pierce",
        "damage_immunity",
        "escape"
      ]
    },
    {
      "id": "juggernaut_duelist",
      "Name": "Duelist",
      "behavior": [
        "passive"
      ],
      "breakable": true,
      "order": 15,
      "type": "passive",
      "tags": [
        "outgoing_damage_amplification"
      ]
    },
    {
      "id": "juggernaut_innate_mask_spin_crit",
      "behavior": [
        "passive"
      ],
      "order": 16,
      "type": "passive",
      "tags": []
    },
    {
      "id": "juggernaut_innate_mask_crit_lifesteal",
      "behavior": [
        "passive"
      ],
      "order": 17,
      "type": "passive",
      "tags": []
    },
    {
      "id": "juggernaut_trinity",
      "behavior": [
        "no-target"
      ],
      "affects": [
        "enemy-units"
      ],
      "dispellable": "no",
      "piercesDebuffImmunity": "yes",
      "damageType": "physical",
      "order": 18,
      "type": "self-target",
      "manaCost": 60,
      "cooldown": 12,
      "tags": []
    },
    {
      "id": "juggernaut_vaulted_strike",
      "behavior": [
        "no-target"
      ],
      "dispellable": "yes",
      "dispelType": "basic",
      "piercesDebuffImmunity": "no",
      "damageType": "magical",
      "order": 19,
      "type": "self-target",
      "manaCost": 60,
      "cooldown": 15,
      "tags": [
        "aoe"
      ]
    }
  ],
  "talents": [
    {
      "id": "special_bonus_unique_juggernaut_5",
      "behavior": [
        "passive"
      ],
      "tags": [
        "buff",
        "cooldown_reduction"
      ]
    },
    {
      "id": "special_bonus_unique_juggernaut_3",
      "behavior": [
        "passive"
      ],
      "tags": []
    },
    {
      "id": "special_bonus_unique_juggernaut_omnislash_cooldown",
      "tags": [
        "buff",
        "cooldown_reduction"
      ]
    },
    {
      "id": "special_bonus_unique_juggernaut_blade_fury_movespeed",
      "behavior": [
        "passive"
      ],
      "tags": []
    },
    {
      "id": "special_bonus_unique_juggernaut_4",
      "behavior": [
        "passive"
      ],
      "tags": []
    },
    {
      "id": "special_bonus_unique_juggernaut",
      "tags": []
    },
    {
      "id": "special_bonus_unique_juggernaut_omnislash_duration",
      "behavior": [
        "passive"
      ],
      "tags": [
        "duration_extension"
      ]
    },
    {
      "id": "special_bonus_unique_juggernaut_blade_dance_lifesteal",
      "behavior": [
        "passive"
      ],
      "tags": []
    },
    {
      "id": "special_bonus_unique_juggernaut_2",
      "behavior": [
        "passive"
      ],
      "tags": []
    },
    {
      "id": "special_bonus_unique_juggernaut_blade_fury_cooldown",
      "behavior": [
        "passive"
      ],
      "tags": []
    },
    {
      "id": "special_bonus_unique_juggernaut_healing_ward_heal",
      "behavior": [
        "passive"
      ],
      "tags": []
    }
  ],
  "bonus_attributes": {
    "id": "special_bonus_attributes",
    "behavior": [
      "passive"
    ],
    "tags": []
  }
}
