{
  "innate": {
    "id": "abyssal_underlord_raid_boss",
    "Name": "Invading Force",
    "behavior": [
      "passive"
    ],
    "breakable": true,
    "tags": [
      "ally_movement_speed",
      "buff",
      "damage_reduction",
      "escape",
      "mobility",
      "self_movement_speed"
    ]
  },
  "skills": [
    {
      "id": "abyssal_underlord_firestorm",
      "Name": "Firestorm",
      "behavior": [
        "point-target"
      ],
      "dispellable": "yes",
      "dispelType": "basic",
      "piercesDebuffImmunity": "no",
      "damageType": "magical",
      "order": 0,
      "type": "point",
      "manaCost": [
        110,
        125,
        140,
        155
      ],
      "tags": [
        "aoe"
      ]
    },
    {
      "id": "abyssal_underlord_pit_of_malice",
      "Name": "Pit of Malice",
      "behavior": [
        "point-target"
      ],
      "dispellable": "yes",
      "dispelType": "basic",
      "piercesDebuffImmunity": "no",
      "damageType": "magical",
      "order": 1,
      "type": "point",
      "manaCost": [
        110,
        120,
        130,
        140
      ],
      "cooldown": [
        30,
        25,
        20,
        15
      ],
      "tags": [
        "aoe",
        "disable",
        "root"
      ]
    },
    {
      "id": "abyssal_underlord_atrophy_aura",
      "Name": "Atrophy Aura",
      "behavior": [
        "passive"
      ],
      "affects": [
        "enemy-units"
      ],
      "dispellable": "no",
      "piercesDebuffImmunity": "allies-only",
      "damageType": "physical",
      "breakable": true,
      "order": 2,
      "type": "passive",
      "tags": [
        "aura"
      ]
    },
    {
      "id": "generic_hidden",
      "order": 4,
      "type": "unknown",
      "tags": []
    },
    {
      "id": "abyssal_underlord_dark_portal",
      "Name": "Fiend's Gate",
      "behavior": [
        "point-target"
      ],
      "dispellable": "yes",
      "dispelType": "basic",
      "order": 5,
      "type": "point",
      "manaCost": 175,
      "tags": [
        "blink",
        "escape",
        "mobility",
        "self_reposition"
      ]
    },
    {
      "id": "abyssal_underlord_dark_rift",
      "behavior": [
        "point-target",
        "unit-target"
      ],
      "affects": [
        "allied-buildings",
        "allied-units"
      ],
      "dispellable": "no",
      "order": 15,
      "type": "target-or-point",
      "target": [
        "ally_building"
      ],
      "manaCost": [
        100,
        200,
        300
      ],
      "cooldown": [
        110,
        100,
        90
      ],
      "tags": []
    },
    {
      "id": "abyssal_underlord_cancel_dark_rift",
      "behavior": [
        "no-target"
      ],
      "order": 16,
      "type": "self-target",
      "tags": []
    },
    {
      "id": "abyssal_underlord_portal_warp",
      "behavior": [
        "channeled",
        "unit-target"
      ],
      "affects": [
        "enemy-units"
      ],
      "order": 17,
      "type": "target",
      "tags": [
        "channeled"
      ]
    },
    {
      "id": "abyssal_underlord_abyssal_horde",
      "Name": "Abyssal Horde",
      "behavior": [
        "passive"
      ],
      "order": 18,
      "type": "passive",
      "tags": [
        "summons"
      ]
    },
    {
      "id": "abyssal_underling_warrior_last_will",
      "Name": "Last Will",
      "behavior": [
        "passive"
      ],
      "damageType": "magical",
      "breakable": true,
      "order": 19,
      "type": "passive",
      "tags": []
    },
    {
      "id": "abyssal_underling_warrior_mana_burn",
      "Name": "Mana Break",
      "behavior": [
        "passive"
      ],
      "damageType": "physical",
      "breakable": true,
      "order": 20,
      "type": "passive",
      "tags": [
        "mana_burn"
      ]
    },
    {
      "id": "abyssal_underling_archer_aoe",
      "Name": "Archer Aura",
      "behavior": [
        "passive"
      ],
      "breakable": true,
      "order": 21,
      "type": "passive",
      "tags": [
        "buff",
        "self_movement_speed"
      ]
    }
  ],
  "talents": [
    {
      "id": "special_bonus_unique_underlord_7",
      "tags": []
    },
    {
      "id": "special_bonus_unique_underlord_8",
      "tags": []
    },
    {
      "id": "special_bonus_unique_underlord_6",
      "tags": []
    },
    {
      "id": "special_bonus_unique_underlord_5",
      "tags": [
        "buff",
        "cooldown_reduction"
      ]
    },
    {
      "id": "special_bonus_unique_underlord_4",
      "tags": []
    },
    {
      "id": "special_bonus_unique_underlord_3",
      "tags": []
    },
    {
      "id": "special_bonus_unique_underlord",
      "tags": []
    },
    {
      "id": "special_bonus_unique_underlord_9",
      "tags": []
    }
  ],
  "bonus_attributes": {
    "id": "special_bonus_attributes",
    "behavior": [
      "passive"
    ],
    "tags": []
  }
}
