{
  "innate": {
    "id": "monkey_king_mischief",
    "Name": "Mischief",
    "behavior": [
      "no-target"
    ],
    "type": "self-target",
    "manaCost": 0,
    "tags": [
      "damage_immunity",
      "escape"
    ]
  },
  "skills": [
    {
      "id": "monkey_king_boundless_strike",
      "Name": "Boundless Strike",
      "behavior": [
        "point-target"
      ],
      "affects": [
        "enemy-units"
      ],
      "dispellable": "strong-only",
      "dispelType": "strong",
      "piercesDebuffImmunity": "no",
      "damageType": "physical",
      "order": 0,
      "type": "point",
      "manaCost": [
        85,
        90,
        95,
        100
      ],
      "tags": [
        "attack_damage_scaling",
        "disable",
        "escape",
        "mobility",
        "self_reposition",
        "stun"
      ]
    },
    {
      "id": "monkey_king_tree_dance",
      "Name": "Tree Dance",
      "behavior": [
        "unit-target"
      ],
      "affects": [
        "trees"
      ],
      "order": 1,
      "type": "target",
      "target": [
        "tree"
      ],
      "manaCost": 0,
      "cooldown": [
        0.9,
        0.6,
        0.3,
        0
      ],
      "tags": [
        "escape",
        "mobility",
        "self_reposition"
      ]
    },
    {
      "id": "monkey_king_primal_spring",
      "Name": "Primal Spring",
      "behavior": [
        "channeled",
        "point-target"
      ],
      "dispellable": "yes",
      "dispelType": "basic",
      "piercesDebuffImmunity": "no",
      "damageType": "magical",
      "order": 2,
      "type": "point",
      "manaCost": 100,
      "tags": [
        "aoe",
        "channeled",
        "slow"
      ]
    },
    {
      "id": "monkey_king_jingu_mastery",
      "Name": "Jingu Mastery",
      "behavior": [
        "passive"
      ],
      "dispellable": "no",
      "piercesDebuffImmunity": "yes",
      "damageType": "physical",
      "breakable": true,
      "order": 3,
      "type": "passive",
      "tags": [
        "bkb_pierce",
        "buff",
        "self_attack_damage",
        "self_lifesteal"
      ]
    },
    {
      "id": "monkey_king_wukongs_command",
      "Name": "Wukong's Command",
      "behavior": [
        "point-target"
      ],
      "damageType": "physical",
      "order": 5,
      "type": "point",
      "manaCost": 100,
      "cooldown": [
        100,
        90,
        80
      ],
      "tags": [
        "aoe",
        "buff",
        "self_armor"
      ]
    },
    {
      "id": "monkey_king_primal_spring_early",
      "behavior": [
        "no-target"
      ],
      "order": 6,
      "type": "self-target",
      "tags": []
    },
    {
      "id": "monkey_king_untransform",
      "Name": "Revert Form",
      "behavior": [
        "no-target"
      ],
      "order": 7,
      "type": "self-target",
      "manaCost": 0,
      "cooldown": 1,
      "tags": []
    },
    {
      "id": "monkey_king_transfiguration",
      "Name": "Changing of the Guard",
      "behavior": [
        "point-target"
      ],
      "order": 8,
      "type": "point",
      "manaCost": 0,
      "cooldown": 5,
      "tags": [
        "damage_immunity",
        "escape"
      ]
    }
  ],
  "talents": [
    {
      "id": "special_bonus_unique_monkey_king_7",
      "tags": []
    },
    {
      "id": "special_bonus_unique_monkey_king_9",
      "tags": [
        "duration_extension",
        "stun"
      ]
    },
    {
      "id": "special_bonus_unique_monkey_king_8",
      "Name": "0 Cooldown Primal Spring",
      "tags": [
        "buff",
        "cooldown_reduction"
      ]
    },
    {
      "id": "special_bonus_unique_monkey_king_2",
      "tags": []
    },
    {
      "id": "special_bonus_unique_monkey_king_3",
      "Name": "Jingu Mastery Undispellable",
      "tags": []
    },
    {
      "id": "special_bonus_unique_monkey_king_10",
      "tags": []
    },
    {
      "id": "special_bonus_unique_monkey_king_11",
      "tags": []
    },
    {
      "id": "special_bonus_unique_monkey_king_6",
      "Name": "Additional Wukong's Command Ring",
      "tags": []
    }
  ],
  "bonus_attributes": {
    "id": "special_bonus_attributes",
    "behavior": [
      "passive"
    ],
    "tags": []
  }
}
