{
  "innate": [
    {
      "id": "spectre_desolate",
      "Name": "Desolate",
      "behavior": [
        "passive"
      ],
      "piercesDebuffImmunity": "yes",
      "damageType": "pure",
      "breakable": true,
      "tags": [
        "bkb_pierce"
      ]
    },
    {
      "id": "spectre_spectral",
      "Name": "Spectral",
      "behavior": [
        "passive"
      ],
      "tags": [
        "buff",
        "self_movement_speed"
      ]
    }
  ],
  "skills": [
    {
      "id": "spectre_spectral_dagger",
      "Name": "Spectral Dagger",
      "behavior": [
        "point-target",
        "unit-target"
      ],
      "affects": [
        "enemy-heroes"
      ],
      "dispellable": "yes",
      "dispelType": "basic",
      "damageType": "magical",
      "order": 0,
      "type": "target-or-point",
      "target": [
        "enemy_hero"
      ],
      "manaCost": [
        100,
        110,
        120,
        130
      ],
      "tags": [
        "escape",
        "mobility",
        "slow"
      ]
    },
    {
      "id": "spectre_shadow_step",
      "Name": "Shadow Step",
      "behavior": [
        "unit-target"
      ],
      "affects": [
        "enemy-heroes"
      ],
      "piercesDebuffImmunity": "yes",
      "order": 1,
      "type": "target",
      "target": [
        "enemy_hero"
      ],
      "manaCost": [
        60,
        65,
        70,
        75
      ],
      "cooldown": [
        24,
        21,
        18,
        15
      ],
      "tags": [
        "aoe",
        "illusions"
      ]
    },
    {
      "id": "spectre_dispersion",
      "Name": "Dispersion",
      "behavior": [
        "passive"
      ],
      "piercesDebuffImmunity": "yes",
      "breakable": true,
      "order": 2,
      "type": "passive",
      "tags": [
        "damage_reflection"
      ]
    },
    {
      "id": "spectre_reality",
      "Name": "Reality",
      "behavior": [
        "point-target"
      ],
      "order": 3,
      "type": "point",
      "manaCost": 25,
      "tags": [
        "escape",
        "mobility"
      ]
    },
    {
      "id": "spectre_haunt",
      "Name": "Haunt",
      "behavior": [
        "no-target"
      ],
      "piercesDebuffImmunity": "yes",
      "order": 5,
      "type": "self-target",
      "manaCost": [
        125,
        175,
        225
      ],
      "tags": [
        "bkb_pierce",
        "buff",
        "cooldown_reduction",
        "illusions"
      ]
    }
  ],
  "talents": [
    {
      "id": "special_bonus_unique_spectre",
      "tags": [
        "buff",
        "cooldown_reduction"
      ]
    },
    {
      "id": "special_bonus_unique_spectre_2",
      "tags": [
        "ability_damage_bonus",
        "buff"
      ]
    },
    {
      "id": "special_bonus_unique_spectre_shadow_step_duration",
      "tags": [
        "duration_extension"
      ]
    },
    {
      "id": "special_bonus_unique_spectre_6",
      "tags": [
        "ability_damage_bonus",
        "buff"
      ]
    },
    {
      "id": "special_bonus_hp_300",
      "Name": "+300 Health",
      "behavior": [
        "passive"
      ],
      "tags": [
        "buff",
        "self_max_health"
      ]
    },
    {
      "id": "special_bonus_unique_spectre_3",
      "tags": []
    },
    {
      "id": "special_bonus_unique_spectre_4",
      "tags": []
    },
    {
      "id": "special_bonus_unique_spectre_5",
      "tags": []
    }
  ],
  "bonus_attributes": {
    "id": "special_bonus_attributes",
    "behavior": [
      "passive"
    ],
    "tags": []
  }
}
